{"buildSetId":"initial-warehouse-v1","candidatePolicy":{"checksumsTemplate":"sha256sums-<buildSetId>.txt","destinationCredentialAllowed":false,"immutableReleaseRequired":true,"inputArtifactPinningRequired":true,"protectedDefaultBranchRequired":true,"sourceManifestTemplate":"source-manifest-<buildSetId>.json","typedAssetListRequired":true},"components":[{"componentId":"celestia-appd-6.4.10-linux-arm64","manifestPath":"catalog/components/celestia-appd-6.4.10-linux-arm64.json","manifestSha256":"59c65eabeae2179c273741c27a0af5ad5bb4c77e4310d7dc0cb6a26176b828be"},{"componentId":"celestia-node-0.28.4-linux-arm64","manifestPath":"catalog/components/celestia-node-0.28.4-linux-arm64.json","manifestSha256":"7bd9b7c734d2300a390b347f7e65f1e489deefdcdc1572c53bf5f660a5b4a8cf"},{"componentId":"indexer-standalone-linux-amd64-4.4.0-rc.3","manifestPath":"catalog/components/indexer-standalone-linux-amd64-4.4.0-rc.3.json","manifestSha256":"5ec8fef85f9742ee9589ae48e17ca5e3e8f62a1d3b7c07ac3293eb752c0e5531"},{"componentId":"indexer-standalone-linux-arm64-4.4.0-rc.3","manifestPath":"catalog/components/indexer-standalone-linux-arm64-4.4.0-rc.3.json","manifestSha256":"6b7cb632e29dc36e820da5d6ef54b01b51e18c6c82bc1a6d540f291956f5aaad"},{"componentId":"indexer-standalone-macos-amd64-4.4.0-rc.3","manifestPath":"catalog/components/indexer-standalone-macos-amd64-4.4.0-rc.3.json","manifestSha256":"63457c7efd879b907d6abe3127f7c26b99740393984d74701c35409ef3c6ff60"},{"componentId":"indexer-standalone-macos-arm64-4.4.0-rc.3","manifestPath":"catalog/components/indexer-standalone-macos-arm64-4.4.0-rc.3.json","manifestSha256":"26fdbecc07d2a2d3980c38901049f675bc388b565e633c5250aa162c8c30f53e"},{"componentId":"midnight-ledger-static-9.0.0","manifestPath":"catalog/components/midnight-ledger-static-9.0.0.json","manifestSha256":"3da06a2a85992212127070101c18b39f51620b8c8605aa7d869278b6f98716c1"},{"componentId":"midnight-node-2.0.0-rc.4-linux-arm64","manifestPath":"catalog/components/midnight-node-2.0.0-rc.4-linux-arm64.json","manifestSha256":"4a55943a745af8817a1bfeb71f657cbacb6473a8346c96d38a25af8ba05207c2"},{"componentId":"midnight-node-toolkit-2.0.0-rc.4-linux-amd64","manifestPath":"catalog/components/midnight-node-toolkit-2.0.0-rc.4-linux-amd64.json","manifestSha256":"fde7a617ac19a3cd56f65b9462ea2cc481152b7b264211623eeb8eb7d7868cea"},{"componentId":"midnight-node-toolkit-2.0.0-rc.4-linux-arm64","manifestPath":"catalog/components/midnight-node-toolkit-2.0.0-rc.4-linux-arm64.json","manifestSha256":"aa5d5d598d4c538e1e4cc855a2d7786c4835fccdff722599154d2c15a69fd558"},{"componentId":"midnight-node-toolkit-2.0.0-rc.4-macos-arm64","manifestPath":"catalog/components/midnight-node-toolkit-2.0.0-rc.4-macos-arm64.json","manifestSha256":"5eb01a7ca32a1860525b0abf0719d99abc85f55fd5eafa14181a3be0eba13e63"},{"componentId":"midnight-srs-k0","manifestPath":"catalog/components/midnight-srs-k0.json","manifestSha256":"96b93dc4670efd7765480986a3348428fd4e8ad24539ed84cf6624f35f9bffea"},{"componentId":"midnight-srs-k1","manifestPath":"catalog/components/midnight-srs-k1.json","manifestSha256":"b32784a7645f41b445afd05c9cd80dd5bb925e5c6d0ac78777043b02d4784765"},{"componentId":"midnight-srs-k10","manifestPath":"catalog/components/midnight-srs-k10.json","manifestSha256":"cb9fd03572750a000b2e293e19a229dc45bd66e9259b3449fadf3bf7680c00e9"},{"componentId":"midnight-srs-k11","manifestPath":"catalog/components/midnight-srs-k11.json","manifestSha256":"ad4b0c160ca6844aa561b8a1d223943ee491b6038558d320d5c8fd97592c0e4f"},{"componentId":"midnight-srs-k12","manifestPath":"catalog/components/midnight-srs-k12.json","manifestSha256":"571cec78e30abf1838e475a0226efda56ec1388f16b831658babfc6f7f9f167f"},{"componentId":"midnight-srs-k13","manifestPath":"catalog/components/midnight-srs-k13.json","manifestSha256":"0f3db81343cebc66f3282ed31f58e4f2c8314890ea9f3a0981a2940ce21f601f"},{"componentId":"midnight-srs-k14","manifestPath":"catalog/components/midnight-srs-k14.json","manifestSha256":"c959d6b179d7da155e9d54e47258106696c9c6a670dc4bbcbe7cf6ed9fb63720"},{"componentId":"midnight-srs-k15","manifestPath":"catalog/components/midnight-srs-k15.json","manifestSha256":"96e7fb7101fb3f0721c76be00a74d3eb905ef54a2641cbd1fac266af4d667fb7"},{"componentId":"midnight-srs-k16","manifestPath":"catalog/components/midnight-srs-k16.json","manifestSha256":"1f33014e3f1d2e7abaaa693dbfe2fe0094ea427201d07b44336c79d6b3c37de4"},{"componentId":"midnight-srs-k17","manifestPath":"catalog/components/midnight-srs-k17.json","manifestSha256":"fe59fb43db14585bcadb8eb4f3a13e9471df967a34bec2dbd40283814d9e454d"},{"componentId":"midnight-srs-k18","manifestPath":"catalog/components/midnight-srs-k18.json","manifestSha256":"d7b31231be36ce2905e9b478421b8967b7a4cbededb11413adc02386ad37ad07"},{"componentId":"midnight-srs-k19","manifestPath":"catalog/components/midnight-srs-k19.json","manifestSha256":"4ed42289e8e3b24b255dfc00ee868c2341b189979290a2adb2d89c81bbacf447"},{"componentId":"midnight-srs-k2","manifestPath":"catalog/components/midnight-srs-k2.json","manifestSha256":"ca323861f22c673af8ebca56a846eb20d9a1859859e029bca542240c56b63eb3"},{"componentId":"midnight-srs-k3","manifestPath":"catalog/components/midnight-srs-k3.json","manifestSha256":"50171b4c63116d4ce0ccdd830c85b069d51fd3c5655ed977de8c38be9ea5b110"},{"componentId":"midnight-srs-k4","manifestPath":"catalog/components/midnight-srs-k4.json","manifestSha256":"d37c242136b53b12a96617bb90e02ab9756cb6e9be7f0d5803694b0df94e6d5d"},{"componentId":"midnight-srs-k5","manifestPath":"catalog/components/midnight-srs-k5.json","manifestSha256":"108579a6fd1a411b0177215a051fc9c941632108b6d7483eb0c27e6cae5b9498"},{"componentId":"midnight-srs-k6","manifestPath":"catalog/components/midnight-srs-k6.json","manifestSha256":"89455050237cdc39ee6308836b1781422e1bcbe03651e89ccf4c9f8ec2e2cd17"},{"componentId":"midnight-srs-k7","manifestPath":"catalog/components/midnight-srs-k7.json","manifestSha256":"067c1e0c42f84c4ba86dc351c562a19727a9ec9f24f0dc3ed9c3ecd62c4fabc2"},{"componentId":"midnight-srs-k8","manifestPath":"catalog/components/midnight-srs-k8.json","manifestSha256":"4ea018017431291c216e2060dab31c8cd8acd3e76a56161afb48c42a9dc343e0"},{"componentId":"midnight-srs-k9","manifestPath":"catalog/components/midnight-srs-k9.json","manifestSha256":"4e4b149df4d8d18d601ccd88fcdb788cafd754ba49066e7d51517c46849536c9"}],"coveragePolicy":{"desired":["linux/arm64"],"optional":["macos/amd64"],"proofDataPlatform":"noarch","required":["linux/amd64","macos/arm64"]},"destination":{"distributionTier":"development-only","releaseMutability":"mutable-warehouse","repository":"effectstream/binaries","tag":"0.3.120"},"existingCoverage":[{"arch":"amd64","assetId":378640596,"assetNodeId":"RA_kwDOQpztJs4WkZjU","family":"celestia-appd","name":"celestia-appd-linux-amd64-v6.4.10.tar.gz","os":"linux","releaseId":270761136,"releaseNodeId":"RE_kwDOQpztJs4QI3yw","releaseTag":"0.3.120","repository":"effectstream/binaries","repositoryId":1117580582,"repositoryNodeId":"R_kgDOQpztJg","sha256":"fa1826187a91514c6d506e22f1fcce25afbd551b98458caf899801b662a0c8da","size":198844329,"snapshotPath":"evidence/phase0/warehouse-release-0.3.120.json","snapshotSha256":"6cb1abbbcf3e693e85b1d6806569caec956d5627b4aeb18ba413b519216124e1","source":"warehouse-existing","tier":"required","version":"6.4.10"},{"arch":"arm64","assetId":378640593,"assetNodeId":"RA_kwDOQpztJs4WkZjR","family":"celestia-appd","name":"celestia-appd-macos-arm64-v6.4.10.tar.gz","os":"macos","releaseId":270761136,"releaseNodeId":"RE_kwDOQpztJs4QI3yw","releaseTag":"0.3.120","repository":"effectstream/binaries","repositoryId":1117580582,"repositoryNodeId":"R_kgDOQpztJg","sha256":"832f4b919d79768b960e55f6d778366d9afbb95df6a860e344dffbb92e85b5be","size":196072247,"snapshotPath":"evidence/phase0/warehouse-release-0.3.120.json","snapshotSha256":"6cb1abbbcf3e693e85b1d6806569caec956d5627b4aeb18ba413b519216124e1","source":"warehouse-existing","tier":"required","version":"6.4.10"},{"arch":"amd64","assetId":378640594,"assetNodeId":"RA_kwDOQpztJs4WkZjS","family":"celestia-node","name":"celestia-node-linux-amd64-v0.28.4.tar.gz","os":"linux","releaseId":270761136,"releaseNodeId":"RE_kwDOQpztJs4QI3yw","releaseTag":"0.3.120","repository":"effectstream/binaries","repositoryId":1117580582,"repositoryNodeId":"R_kgDOQpztJg","sha256":"bb8b9fd2ac859945fdf2f8c84ba038f75e01be54e56d1a946cbbd4b540f120d9","size":78842331,"snapshotPath":"evidence/phase0/warehouse-release-0.3.120.json","snapshotSha256":"6cb1abbbcf3e693e85b1d6806569caec956d5627b4aeb18ba413b519216124e1","source":"warehouse-existing","tier":"required","version":"0.28.4"},{"arch":"arm64","assetId":378640595,"assetNodeId":"RA_kwDOQpztJs4WkZjT","family":"celestia-node","name":"celestia-node-macos-arm64-v0.28.4.tar.gz","os":"macos","releaseId":270761136,"releaseNodeId":"RE_kwDOQpztJs4QI3yw","releaseTag":"0.3.120","repository":"effectstream/binaries","repositoryId":1117580582,"repositoryNodeId":"R_kgDOQpztJg","sha256":"d2d637282489ea1ffc37a5fded4997be7140a7e77a43f0ea61a68f0f73069821","size":76777711,"snapshotPath":"evidence/phase0/warehouse-release-0.3.120.json","snapshotSha256":"6cb1abbbcf3e693e85b1d6806569caec956d5627b4aeb18ba413b519216124e1","source":"warehouse-existing","tier":"required","version":"0.28.4"},{"arch":"amd64","assetId":526514404,"assetNodeId":"RA_kwDOQpztJs4fYfjk","family":"midnight-node","name":"midnight-node-linux-amd64-2.0.0-rc.4.zip","os":"linux","releaseId":270761136,"releaseNodeId":"RE_kwDOQpztJs4QI3yw","releaseTag":"0.3.120","repository":"effectstream/binaries","repositoryId":1117580582,"repositoryNodeId":"R_kgDOQpztJg","sha256":"8f53e9dfb2c70ec2fb98fd6958466ef107685774ca4d93660bc63e7686948879","size":84751613,"snapshotPath":"evidence/phase0/warehouse-release-0.3.120.json","snapshotSha256":"6cb1abbbcf3e693e85b1d6806569caec956d5627b4aeb18ba413b519216124e1","source":"warehouse-existing","tier":"required","version":"2.0.0-rc.4"},{"arch":"arm64","assetId":526513732,"assetNodeId":"RA_kwDOQpztJs4fYfZE","family":"midnight-node","name":"midnight-node-macos-a